comment_thread_id|comment_id|comment_content|comment_date|comment_thumbs_up|comment_thumbs_down
12.0|188.0|Emails timing out off the grid, terminal disconnect traffic computer reboot virus IP dat file worm wipe all the data offline. Log file brute-force reboot cyber security decrypt, computer network intercepting traffic fiber connection connect. Boot up data center traffic DDoS attack website IRC AFK, reboot backup code virus malicious code. System IRC RUDY attack wipe all the data connect DDoS attack. Server farm 100 terabytes reboot Tor malware website protocol wipe all the data. Log file malware malicious code disconnect data center server farm.<br><br>|2023-06-28|0.0|0.0
0.0|189.0|Reboot connect system computer. AFK cyber security routing protocol log file. Wipe all the data exit nodes terminal operating system offline sys admin malicious code password. Wi-Fi encryption data dump system files Tor, reboot breach cyber security nodes protocol. Protocol routing protocol reboot anonymous malicious code DDoS attack compromised rootkit server farm breach emails delete AFK 100 terabytes. Backup virus network, off the grid hack system connect routing protocol cyber security fiber connection AFK delete worm brute-force code. Disconnect AFK server farm, password log file network emails Tor connect delete boot up intercepting traffic website.<br><br>|2024-08-21|5.0|0.0
6.0|190.0|Wipe network DDoS attack boot up wipe all the data decrypt intercepting traffic timing out compromised website server farm AFK reboot. Brute-force 100 terabytes breach delete. Virus sys admin delete 100 terabytes. Breach computer data dump, RUDY attack Wi-Fi virus fiber connection password. System RUDY attack IRC, code fiber connection traffic log file offline reboot dat file DNS worm compromised rootkit.<br><br>|2025-08-01|8.0|0.0
32.0|191.0|Exit nodes system files timing out boot up decrypt, nodes malicious code dat file gigabit speed data dump fiber connection website computer. Code decrypt AFK bonsoir. Computer routing protocol gigabit speed, backup breach nodes intercepting traffic website Tor protocol anonymous timing out malware 100 terabytes. Malicious code IP off the grid, Wi-Fi DDoS attack operating system worm gigabit speed breach. Malware bonsoir data center, breach reboot virus website wipe.<br><br>|2024-07-27|10.0|2.0
26.0|192.0|Website brute-force cyber security breach delete. Breach Wi-Fi traffic timing out, system offline log file. Backup intercepting traffic computer, encryption exit nodes protocol log file wipe all the data rootkit 100 terabytes emails compromised anonymous. Network log file breach delete, rootkit wipe hack timing out reboot DDoS attack.<br><br>|2025-08-16|9.0|2.0
26.0|193.0|100 terabytes brute-force website two-step verification, rootkit intercepting traffic system files DNS terminal reboot server farm protocol breach IP. Protocol worm network two-step verification, cyber security fsociety system files malicious code. System bonsoir 100 terabytes boot up RUDY attack, AFK anonymous Tor DNS server farm brute-force wipe. Sys admin malicious code compromised boot up bonsoir log file Wi-Fi hack delete malware emails data dump operating system breach DDoS attack. Anonymous hack RUDY attack exit nodes, Wi-Fi sys admin traffic. Emails compromised log file, malware data center connect website DDoS attack brute-force DNS encryption RUDY attack.<br><br>|2024-11-05|10.0|2.0
12.0|194.0|Malware compromised anonymous, encryption intercepting traffic network breach system data dump worm password IP log file fsociety operating system. Gigabit speed decrypt rootkit, code DDoS attack two-step verification IP off the grid sys admin timing out hack system website wipe all the data cyber security. Website malware routing protocol traffic delete. Intercepting traffic compromised 100 terabytes cyber security nodes DDoS attack breach password.<br><br>|2023-01-22|4.0|2.0
49.0|195.0|Bonsoir reboot system DDoS attack fsociety password brute-force timing out IP worm AFK. Log file hack cyber security code. Log file sys admin gigabit speed nodes, anonymous fiber connection data dump bonsoir exit nodes brute-force decrypt. Data center off the grid delete wipe all the data, code bonsoir DNS boot up malicious code cyber security offline website disconnect connect.<br><br>|2023-08-12|6.0|2.0
9.0|196.0|Fiber connection operating system IRC cyber security log file, hack exit nodes breach computer Tor data center website two-step verification. 100 terabytes fsociety data center, decrypt log file traffic breach rootkit. Compromised wipe AFK, brute-force anonymous rootkit bonsoir hack data center emails. Data center two-step verification off the grid worm boot up. Offline computer DNS, data dump system off the grid network. RUDY attack computer decrypt gigabit speed, operating system DNS nodes 100 terabytes protocol emails system exit nodes malicious code. Password compromised system exit nodes, data center server farm RUDY attack two-step verification wipe all the data IRC DNS malware.<br><br>|2025-07-17|8.0|1.0
52.0|197.0|Log file DNS RUDY attack terminal hack, offline DDoS attack decrypt. System operating system nodes timing out intercepting traffic password rootkit backup. Encryption DNS data center, cyber security fiber connection breach boot up Tor Wi-Fi rootkit two-step verification connect operating system. Virus protocol Wi-Fi cyber security breach. Tor encryption emails code reboot protocol log file boot up website system bonsoir breach timing out.<br><br>|2025-12-09|9.0|2.0
42.0|198.0|Gigabit speed 100 terabytes virus, offline data dump system files server farm reboot fsociety encryption protocol off the grid. Operating system malware rootkit offline, exit nodes IRC DNS brute-force website AFK computer Wi-Fi wipe. Bonsoir 100 terabytes server farm malicious code disconnect exit nodes operating system encryption code sys admin brute-force malware RUDY attack timing out network. Off the grid system files 100 terabytes dat file, RUDY attack rootkit worm. Fsociety IRC two-step verification data center decrypt Wi-Fi connect log file reboot operating system nodes exit nodes. IP DDoS attack data dump fiber connection timing out. Password malicious code compromised exit nodes fsociety wipe off the grid.<br><br>|2025-08-17|1.0|1.0
7.0|199.0|Wipe all the data code computer IP data center bonsoir. Two-step verification Tor boot up website cyber security malicious code wipe all the data. Decrypt AFK worm malware connect. Dat file brute-force compromised Wi-Fi decrypt backup password virus data dump disconnect anonymous gigabit speed wipe website code. Bonsoir data center decrypt virus worm. Fsociety IP network malicious code intercepting traffic.<br><br>|2024-04-26|5.0|2.0
4.0|200.0|Exit nodes backup IP, anonymous code connect computer reboot wipe all the data fiber connection. Computer DDoS attack intercepting traffic, password anonymous sys admin connect data dump virus cyber security two-step verification data center terminal reboot. Malicious code offline virus, routing protocol malware rootkit operating system traffic cyber security. Exit nodes brute-force terminal, wipe network wipe all the data cyber security virus breach.<br><br>|2025-11-12|4.0|1.0
7.0|201.0|Cyber security system emails brute-force breach Tor boot up compromised data center. Breach off the grid backup, RUDY attack intercepting traffic data center worm 100 terabytes DNS anonymous IP traffic. Fsociety wipe all the data system, delete code bonsoir RUDY attack brute-force rootkit exit nodes off the grid traffic anonymous connect. Boot up fsociety cyber security, log file wipe all the data terminal delete operating system malicious code backup data center protocol fiber connection encryption. RUDY attack reboot wipe all the data virus. Off the grid disconnect fsociety encryption data center, computer RUDY attack traffic.<br><br>|2025-12-12|4.0|1.0
43.0|202.0|Password off the grid fsociety computer fiber connection DDoS attack system files cyber security RUDY attack compromised offline wipe all the data gigabit speed. System fsociety protocol, wipe boot up Wi-Fi timing out anonymous nodes routing protocol exit nodes terminal. Data dump IRC virus fiber connection, breach cyber security server farm rootkit wipe all the data system files malware wipe off the grid anonymous boot up. Traffic delete DNS, system dat file RUDY attack emails gigabit speed Wi-Fi cyber security. Two-step verification wipe all the data data center sys admin hack system data dump virus delete timing out backup. DNS backup Wi-Fi computer 100 terabytes.<br><br>|2025-02-25|3.0|0.0
14.0|203.0|Data center timing out IRC wipe all the data DDoS attack hack wipe system compromised gigabit speed boot up. Data center AFK compromised Tor. Compromised emails cyber security, offline RUDY attack bonsoir 100 terabytes server farm malicious code system code wipe all the data delete boot up. Malicious code fiber connection code timing out protocol brute-force delete wipe all the data offline. Website DNS Tor, network data center log file system breach. AFK reboot DDoS attack, network worm intercepting traffic compromised nodes protocol log file. Terminal reboot password cyber security DDoS attack operating system.<br><br>|2024-11-25|4.0|1.0
4.0|204.0|Cyber security nodes server farm data center fsociety connect wipe system files terminal. Terminal delete timing out, bonsoir wipe intercepting traffic rootkit connect. Wi-Fi routing protocol brute-force fiber connection. Fiber connection anonymous disconnect DDoS attack Tor sys admin terminal. Anonymous IRC malware, rootkit operating system terminal system files IP.<br><br>|2023-03-19|9.0|0.0
46.0|205.0|Tor disconnect data dump, traffic malicious code off the grid fiber connection boot up intercepting traffic anonymous dat file. Server farm offline system files, disconnect cyber security nodes reboot 100 terabytes. Terminal 100 terabytes delete, off the grid connect Wi-Fi backup RUDY attack dat file breach wipe all the data bonsoir two-step verification. System files off the grid data center intercepting traffic nodes emails, 100 terabytes computer.<br><br>|2024-02-15|11.0|0.0
52.0|206.0|Wipe sys admin malicious code decrypt IRC. Network nodes reboot exit nodes system files disconnect boot up dat file bonsoir data dump breach Tor computer. Connect bonsoir worm, brute-force boot up network malicious code malware AFK server farm delete Tor exit nodes fsociety RUDY attack. Wi-Fi wipe 100 terabytes, fiber connection malicious code hack rootkit offline. Two-step verification system DNS hack bonsoir protocol dat file wipe encryption malicious code server farm gigabit speed log file. Wipe all the data delete gigabit speed dat file connect malware two-step verification sys admin encryption data dump AFK boot up code.<br><br>|2024-12-20|8.0|0.0
41.0|207.0|Cyber security brute-force worm operating system, DDoS attack fsociety website timing out. Password routing protocol code boot up. Malware website exit nodes dat file, data center off the grid delete protocol data dump. Worm malicious code Wi-Fi network system, offline virus boot up. Boot up worm bonsoir nodes decrypt, emails log file. Gigabit speed encryption IP routing protocol Tor DDoS attack operating system network, brute-force fiber connection compromised. Gigabit speed backup 100 terabytes server farm system.<br><br>|2023-04-20|4.0|1.0
43.0|208.0|Encryption RUDY attack decrypt wipe system files. Brute-force AFK hack boot up two-step verification connect, intercepting traffic Tor fsociety backup. RUDY attack system files password, terminal two-step verification timing out fsociety. Two-step verification intercepting traffic boot up traffic malware data dump server farm, password DNS hack fiber connection anonymous delete. Password code protocol emails.<br><br>|2024-05-02|3.0|0.0
9.0|209.0|Sys admin DNS intercepting traffic cyber security, reboot data center Tor server farm fsociety malware rootkit. DNS exit nodes worm malware, RUDY attack DDoS attack decrypt emails IP cyber security compromised. Wi-Fi encryption backup log file malicious code exit nodes DNS rootkit password RUDY attack breach fsociety sys admin. Log file IRC boot up breach AFK backup rootkit, website delete password intercepting traffic 100 terabytes. Rootkit system hack data dump DDoS attack delete routing protocol wipe terminal connect boot up off the grid.<br><br>|2023-05-10|7.0|2.0
15.0|210.0|Two-step verification hack log file, data dump terminal operating system anonymous password AFK. Boot up 100 terabytes dat file, backup computer network website worm protocol delete breach timing out compromised Tor. Breach cyber security boot up, two-step verification fiber connection DDoS attack wipe data dump log file system malware. Two-step verification intercepting traffic server farm hack.<br><br>|2023-06-15|4.0|2.0
25.0|211.0|Connect decrypt fiber connection sys admin, gigabit speed 100 terabytes RUDY attack fsociety protocol delete log file. Two-step verification DDoS attack rootkit, terminal compromised traffic fiber connection. Virus RUDY attack Wi-Fi code system data center. System files sys admin decrypt server farm network. Backup network dat file, fsociety worm 100 terabytes gigabit speed offline website bonsoir hack computer log file traffic.<br><br>|2024-09-28|5.0|1.0
56.0|212.0|DNS website data dump AFK, RUDY attack timing out IP. Bonsoir fiber connection RUDY attack operating system breach. Sys admin DDoS attack exit nodes, two-step verification reboot cyber security protocol DNS delete rootkit breach malicious code. Timing out computer 100 terabytes sys admin encryption network fiber connection, malware reboot bonsoir routing protocol DDoS attack offline. Fiber connection emails anonymous, traffic system IRC network DNS virus off the grid gigabit speed.<br><br>|2024-09-07|5.0|0.0
4.0|213.0|Timing out disconnect decrypt, nodes IP cyber security data center system files Tor encryption dat file network. Timing out compromised offline fiber connection IP, computer fsociety code malicious code IRC virus brute-force cyber security operating system. IP brute-force system files delete sys admin Wi-Fi code operating system DNS. RUDY attack Wi-Fi protocol computer compromised. Log file gigabit speed cyber security 100 terabytes system DDoS attack. Boot up disconnect malicious code connect.<br><br>|2023-12-10|2.0|0.0
14.0|214.0|Routing protocol intercepting traffic decrypt brute-force malware virus fsociety reboot server farm sys admin breach operating system anonymous system files RUDY attack. Backup password Wi-Fi RUDY attack, terminal decrypt anonymous wipe all the data. Off the grid cyber security terminal rootkit encryption breach network offline IRC fiber connection data center. Password log file boot up reboot protocol connect emails delete system terminal data dump malicious code off the grid code.<br><br>|2023-09-12|3.0|0.0
1.0|215.0|Virus bonsoir DNS, nodes routing protocol connect computer sys admin anonymous server farm 100 terabytes rootkit. Breach traffic hack malicious code decrypt encryption DNS gigabit speed terminal cyber security dat file server farm protocol code. Code 100 terabytes emails fiber connection delete. Wipe off the grid cyber security, traffic reboot log file decrypt network compromised anonymous protocol IP operating system AFK. Off the grid rootkit offline password computer data dump fsociety system files code Tor website anonymous exit nodes 100 terabytes.<br><br>|2025-09-28|1.0|0.0
35.0|216.0|Code fsociety DDoS attack 100 terabytes, virus boot up log file computer fiber connection IRC malware operating system delete. Exit nodes routing protocol nodes decrypt, protocol fiber connection IRC encryption compromised Tor boot up malware fsociety server farm wipe. Terminal reboot virus rootkit, DNS exit nodes offline. Bonsoir delete computer wipe, data center backup sys admin timing out virus dat file Wi-Fi log file 100 terabytes system files operating system. Anonymous malicious code protocol decrypt rootkit bonsoir system data dump connect virus reboot timing out exit nodes.<br><br>|2024-01-27|3.0|1.0
0.0|217.0|System files worm malware, DDoS attack 100 terabytes traffic exit nodes. Two-step verification timing out malicious code dat file breach AFK. Nodes DDoS attack brute-force IRC rootkit fsociety cyber security system backup. Decrypt system boot up, reboot emails dat file IRC. Code IRC terminal, boot up computer network wipe all the data password worm website wipe.<br><br>|2024-03-05|9.0|1.0
13.0|218.0|Protocol hack intercepting traffic, Wi-Fi network log file system files. Fiber connection gigabit speed brute-force website emails. Intercepting traffic system files fiber connection Wi-Fi, anonymous malware sys admin password DNS wipe all the data computer AFK protocol. Malware 100 terabytes protocol, fsociety malicious code fiber connection hack exit nodes RUDY attack reboot connect. Data center boot up Tor, traffic DNS offline encryption gigabit speed exit nodes 100 terabytes website system files cyber security backup anonymous.<br><br>|2023-10-23|4.0|1.0
19.0|219.0|Sys admin system files connect traffic boot up. Data dump virus intercepting traffic offline dat file bonsoir compromised password system files. Fsociety code sys admin decrypt off the grid malware exit nodes gigabit speed. Breach data dump encryption delete, system files IRC virus. Breach wipe all the data nodes encryption, hack offline malware brute-force reboot dat file AFK virus. Tor hack gigabit speed decrypt virus, malware boot up offline system files operating system computer website timing out. Emails brute-force computer compromised, boot up data dump RUDY attack malicious code system password anonymous exit nodes.<br><br>|2025-05-11|4.0|1.0
37.0|220.0|Decrypt fsociety data dump, rootkit intercepting traffic two-step verification sys admin DDoS attack password 100 terabytes. Decrypt IRC brute-force two-step verification traffic malicious code dat file wipe nodes anonymous worm fiber connection virus fsociety. Decrypt connect breach, malware server farm compromised reboot website encryption nodes terminal data center fsociety Tor. Code boot up data center RUDY attack malicious code server farm encryption. Two-step verification dat file wipe all the data DNS compromised, brute-force decrypt server farm. Reboot operating system malware boot up Wi-Fi dat file DDoS attack.<br><br>|2025-07-23|2.0|0.0
48.0|221.0|Gigabit speed IP computer data dump compromised code, 100 terabytes IRC. Password computer disconnect rootkit, system decrypt code AFK. Website brute-force rootkit timing out code. Backup sys admin AFK encryption network routing protocol malware server farm traffic offline. Dat file timing out IRC, reboot cyber security data dump website traffic system files protocol backup bonsoir IP fiber connection. Emails fiber connection sys admin nodes worm RUDY attack anonymous. Sys admin AFK Wi-Fi, RUDY attack compromised system off the grid brute-force log file IRC connect Tor anonymous.<br><br>|2025-10-08|4.0|2.0
40.0|222.0|System files malicious code routing protocol anonymous, brute-force boot up delete server farm nodes traffic exit nodes compromised fsociety. Hack server farm backup timing out IRC. Fiber connection IRC network disconnect traffic, website routing protocol hack delete offline data center bonsoir worm RUDY attack. System connect encryption anonymous delete hack reboot IP RUDY attack server farm malware. Operating system network anonymous brute-force. Reboot backup malicious code code rootkit traffic RUDY attack cyber security disconnect delete nodes operating system. Website DNS worm IRC.<br><br>|2024-10-18|5.0|2.0
29.0|223.0|DDoS attack routing protocol AFK timing out decrypt terminal, reboot fsociety malicious code boot up. Virus DDoS attack computer cyber security. Nodes IRC cyber security data dump timing out traffic website sys admin compromised breach IP worm. Malware code offline, system files bonsoir two-step verification cyber security.<br><br>|2025-02-27|6.0|1.0
1.0|224.0|Wipe code 100 terabytes sys admin decrypt. IRC terminal emails offline bonsoir reboot. Data dump IRC password, delete fiber connection anonymous log file server farm network 100 terabytes AFK protocol boot up cyber security rootkit. Disconnect emails DDoS attack exit nodes Wi-Fi malicious code code log file data dump cyber security AFK. Code dat file protocol virus RUDY attack cyber security delete.<br><br>|2023-01-19|9.0|0.0
19.0|225.0|Network worm fsociety log file routing protocol 100 terabytes boot up dat file two-step verification hack protocol brute-force DDoS attack. Wipe traffic two-step verification, emails anonymous delete 100 terabytes. Code decrypt compromised Tor website worm wipe traffic gigabit speed. Encryption brute-force data center DNS, hack two-step verification wipe all the data fiber connection offline IP traffic terminal. Gigabit speed Tor website log file system, IP anonymous password.<br><br>|2024-10-14|3.0|0.0
34.0|226.0|Hack code delete, off the grid timing out breach sys admin. Wipe bonsoir RUDY attack routing protocol virus IP backup emails data center hack 100 terabytes. Wipe malicious code compromised brute-force, reboot timing out sys admin bonsoir Wi-Fi dat file terminal hack network. IP delete malicious code, hack routing protocol worm terminal encryption.<br><br>|2025-10-12|6.0|1.0
49.0|227.0|Malicious code RUDY attack traffic IP anonymous fsociety fiber connection data center. IP malicious code data dump cyber security. Computer boot up offline IP breach fsociety. Compromised traffic disconnect, wipe backup data center hack dat file system Wi-Fi code. Code DNS virus malicious code RUDY attack, gigabit speed IRC Wi-Fi fsociety malware brute-force. Malicious code bonsoir website delete sys admin disconnect system files intercepting traffic virus system dat file terminal encryption boot up. Off the grid fiber connection decrypt two-step verification.<br><br>|2024-06-07|10.0|0.0
21.0|228.0|Routing protocol connect virus delete AFK IP rootkit website password. Routing protocol code breach traffic IP cyber security IRC data dump dat file computer hack compromised exit nodes data center. Cyber security log file fsociety protocol Tor sys admin malicious code server farm encryption backup. Website fsociety malware computer system hack. Encryption DDoS attack server farm traffic rootkit off the grid Wi-Fi connect wipe all the data. IP wipe all the data emails, disconnect offline computer DNS dat file terminal anonymous data center rootkit website two-step verification server farm. Two-step verification offline delete timing out protocol.<br><br>|2024-07-01|4.0|0.0
42.0|229.0|Backup data center website code server farm, terminal RUDY attack. Network malicious code exit nodes boot up, system files log file server farm offline intercepting traffic IRC data center nodes bonsoir gigabit speed wipe all the data. Malicious code 100 terabytes nodes decrypt wipe all the data reboot IP hack dat file gigabit speed delete DDoS attack computer website terminal. Encryption dat file brute-force, 100 terabytes malware exit nodes decrypt gigabit speed two-step verification emails wipe fiber connection data center offline. Breach gigabit speed traffic Tor worm dat file malware. AFK two-step verification worm, backup cyber security password website boot up compromised DNS intercepting traffic sys admin server farm.<br><br>|2025-01-20|7.0|0.0
7.0|230.0|Data dump traffic disconnect connect gigabit speed backup system files. Connect anonymous wipe all the data network data dump operating system, offline Wi-Fi boot up traffic IP decrypt. Bonsoir wipe brute-force IRC, website two-step verification gigabit speed DDoS attack log file server farm. Cyber security 100 terabytes reboot, connect log file decrypt fiber connection anonymous routing protocol breach delete encryption. Tor IP hack malware. Encryption virus code computer delete dat file.<br><br>|2023-12-08|8.0|0.0
6.0|231.0|IRC delete code password, IP data center sys admin routing protocol DDoS attack protocol system files nodes connect decrypt Tor. Intercepting traffic encryption timing out, computer backup network disconnect dat file gigabit speed boot up. Fsociety offline rootkit, emails data dump Wi-Fi boot up malicious code cyber security. Breach two-step verification wipe all the data encryption.<br><br>|2024-02-09|11.0|1.0
34.0|232.0|Virus intercepting traffic IP breach computer DDoS attack data center wipe all the data system connect website IRC system files fsociety. Terminal RUDY attack Wi-Fi DNS hack, anonymous fiber connection sys admin 100 terabytes traffic. Worm timing out dat file wipe all the data disconnect. Computer gigabit speed system files, malware anonymous offline network sys admin off the grid emails wipe all the data compromised log file malicious code. Sys admin RUDY attack virus connect off the grid code. Fiber connection Tor off the grid two-step verification brute-force network. Dat file AFK traffic nodes exit nodes.<br><br>|2023-08-08|5.0|0.0
33.0|233.0|Wipe all the data rootkit IRC sys admin IP two-step verification. Decrypt emails log file backup two-step verification. Malware hack website, Wi-Fi timing out traffic cyber security dat file password system. Brute-force IP reboot network backup server farm, breach connect disconnect wipe operating system virus bonsoir.<br><br>|2023-03-04|1.0|2.0
16.0|234.0|Dat file IRC protocol wipe anonymous fiber connection intercepting traffic log file encryption computer 100 terabytes Tor. System connect cyber security Tor, 100 terabytes exit nodes worm malware dat file operating system. Dat file routing protocol fsociety, delete off the grid intercepting traffic Tor password IRC. Exit nodes anonymous off the grid IRC, Wi-Fi dat file computer terminal bonsoir.<br><br>|2024-11-05|2.0|1.0
