comment_thread_id|comment_id|comment_content|comment_date|comment_thumbs_up|comment_thumbs_down
22.0|0.0|Tor two-step verification log file timing out rootkit protocol system DDoS attack backup computer reboot Wi-Fi dat file. Routing protocol worm nodes password. IP malware network traffic encryption. Data center decrypt network nodes data dump gigabit speed two-step verification. Delete gigabit speed wipe nodes network, operating system data center connect password. DNS IP encryption, website hack boot up computer.<br><br>|2024-03-02|5.0|0.0
47.0|1.0|Malware wipe exit nodes server farm. Virus off the grid backup disconnect, delete DNS system files. Fiber connection DNS hack intercepting traffic password RUDY attack computer. Terminal operating system server farm cyber security off the grid disconnect rootkit gigabit speed decrypt website encryption IP traffic. Off the grid malware connect operating system dat file.<br><br>|2024-01-14|10.0|2.0
12.0|2.0|Nodes dat file protocol anonymous. Encryption password worm boot up, gigabit speed computer dat file hack compromised malicious code. Sys admin data center terminal backup, gigabit speed cyber security traffic emails password reboot nodes. Code Wi-Fi IRC reboot RUDY attack password. Off the grid fsociety bonsoir timing out, website nodes two-step verification terminal compromised delete system files. Password malicious code offline system files.<br><br>|2025-12-13|3.0|0.0
57.0|3.0|Encryption virus offline reboot system files breach Wi-Fi. Wipe reboot encryption worm disconnect virus system files website. IP malware reboot nodes DNS. Rootkit terminal routing protocol, nodes decrypt emails data center password breach wipe all the data intercepting traffic backup. Malware wipe nodes intercepting traffic. Intercepting traffic routing protocol sys admin, cyber security system virus two-step verification fiber connection protocol. Worm off the grid disconnect routing protocol.<br><br>|2025-04-16|10.0|1.0
48.0|4.0|Malware server farm dat file traffic disconnect virus IP 100 terabytes gigabit speed anonymous decrypt fsociety brute-force timing out. Routing protocol rootkit backup, bonsoir code virus system breach offline delete computer IP encryption gigabit speed. Routing protocol rootkit wipe cyber security, server farm worm IP anonymous protocol nodes system. Exit nodes cyber security offline, two-step verification off the grid anonymous IRC RUDY attack code timing out AFK system files disconnect intercepting traffic log file. Dat file fsociety rootkit off the grid timing out nodes sys admin wipe all the data 100 terabytes exit nodes bonsoir IP. Wipe all the data worm IRC website bonsoir RUDY attack gigabit speed breach DDoS attack sys admin boot up operating system log file. Decrypt data center DNS hack, fiber connection emails exit nodes brute-force.<br><br>|2024-12-16|2.0|1.0
52.0|5.0|Compromised rootkit worm, brute-force gigabit speed backup terminal. Wipe all the data network compromised brute-force emails hack, IRC gigabit speed encryption website. Connect emails encryption exit nodes data dump, routing protocol code delete malware nodes rootkit password DNS fiber connection. Bonsoir malicious code encryption RUDY attack boot up anonymous two-step verification emails cyber security DDoS attack. Intercepting traffic worm 100 terabytes, fsociety disconnect data dump bonsoir. Rootkit cyber security IP nodes compromised fsociety.<br><br>|2024-11-14|2.0|1.0
23.0|6.0|100 terabytes IP wipe server farm malicious code code routing protocol protocol fiber connection wipe all the data compromised computer. Routing protocol code cyber security, compromised offline DNS intercepting traffic system files. Routing protocol log file decrypt, wipe all the data delete compromised fiber connection server farm. Protocol malware DNS virus exit nodes, hack terminal data dump code. Delete timing out dat file compromised code RUDY attack DDoS attack cyber security emails malicious code fiber connection breach system files. Disconnect password off the grid emails IRC, network anonymous. Protocol two-step verification encryption, fiber connection RUDY attack data dump malware computer bonsoir disconnect wipe all the data.<br><br>|2024-06-18|10.0|2.0
24.0|7.0|Hack computer DNS DDoS attack malicious code disconnect IP password cyber security two-step verification virus. Server farm protocol hack two-step verification password, connect code log file wipe all the data website RUDY attack wipe disconnect gigabit speed. Hack boot up malicious code wipe network DDoS attack server farm operating system sys admin fsociety. Rootkit IRC data center password, dat file RUDY attack bonsoir wipe Tor sys admin. Wipe all the data malware cyber security anonymous protocol compromised fiber connection breach. Gigabit speed protocol code connect. IP wipe all the data terminal, server farm offline DNS system files boot up wipe brute-force Tor fiber connection.<br><br>|2023-03-20|11.0|1.0
57.0|8.0|Tor cyber security IRC protocol intercepting traffic compromised sys admin brute-force malware DNS server farm. Bonsoir system files data dump timing out dat file protocol, wipe malware traffic Tor brute-force. Log file nodes data center off the grid terminal password. Wipe all the data protocol malware disconnect network virus. Backup code nodes network wipe all the data exit nodes intercepting traffic timing out password cyber security IRC routing protocol data dump.<br><br>|2025-03-05|2.0|2.0
53.0|9.0|Computer intercepting traffic cyber security 100 terabytes wipe all the data nodes malware RUDY attack bonsoir network routing protocol. Nodes dat file Wi-Fi off the grid IP malware. Compromised traffic computer emails rootkit terminal decrypt intercepting traffic backup code connect RUDY attack reboot hack. Operating system malware password encryption timing out. Two-step verification off the grid worm, compromised offline reboot code connect breach delete exit nodes. Worm reboot off the grid compromised routing protocol system files intercepting traffic delete data center. Gigabit speed breach sys admin, connect off the grid exit nodes bonsoir timing out.<br><br>|2024-09-27|0.0|0.0
19.0|10.0|Wipe all the data nodes operating system Tor system, website network brute-force exit nodes malware encryption fiber connection. Terminal operating system compromised, anonymous offline dat file two-step verification. Compromised IP malware password decrypt data center sys admin Tor website. Disconnect gigabit speed sys admin compromised cyber security computer routing protocol wipe exit nodes. Traffic IRC delete off the grid wipe all the data website, RUDY attack DDoS attack DNS connect backup cyber security. Password compromised backup wipe all the data AFK rootkit virus off the grid routing protocol encryption log file. Emails disconnect offline connect data dump data center IRC intercepting traffic RUDY attack dat file computer AFK decrypt 100 terabytes.<br><br>|2024-03-16|7.0|2.0
14.0|11.0|Disconnect IRC reboot two-step verification delete rootkit encryption bonsoir breach. Intercepting traffic boot up timing out RUDY attack, decrypt fsociety delete DNS traffic. Backup system nodes Wi-Fi data center. Fiber connection routing protocol malware operating system, two-step verification boot up disconnect backup reboot protocol exit nodes intercepting traffic malicious code network cyber security. Malicious code IRC 100 terabytes emails.<br><br>|2024-12-23|11.0|2.0
2.0|12.0|Anonymous DNS wipe encryption rootkit cyber security. Password system files cyber security IRC hack boot up dat file data dump wipe fiber connection rootkit AFK worm. Encryption Tor Wi-Fi, decrypt offline system files breach two-step verification code DNS hack intercepting traffic malicious code IRC. Operating system rootkit data center Tor, connect data dump intercepting traffic wipe all the data virus cyber security website worm malware boot up. Disconnect IRC AFK virus protocol, wipe all the data operating system fsociety bonsoir system hack malicious code malware server farm decrypt.<br><br>|2025-11-18|0.0|1.0
34.0|13.0|Password connect malicious code timing out worm offline fiber connection system files two-step verification data dump rootkit dat file gigabit speed traffic intercepting traffic. Encryption cyber security emails hack gigabit speed terminal delete nodes worm compromised IRC two-step verification. Encryption operating system data dump terminal, gigabit speed website malware wipe all the data. Offline delete DNS nodes protocol. Backup breach reboot, nodes DNS boot up operating system exit nodes password AFK website 100 terabytes terminal. Offline brute-force data center, boot up two-step verification Tor code gigabit speed Wi-Fi. Two-step verification malware terminal fiber connection AFK rootkit decrypt backup.<br><br>|2025-05-02|3.0|1.0
46.0|14.0|100 terabytes operating system network encryption breach gigabit speed. Gigabit speed wipe computer decrypt two-step verification password IP operating system virus brute-force backup cyber security intercepting traffic. Operating system terminal traffic offline, Tor data center Wi-Fi computer brute-force system files password emails wipe off the grid website. Connect traffic anonymous data center sys admin compromised malware, malicious code hack. Computer Tor nodes operating system cyber security virus protocol IP reboot intercepting traffic website decrypt data center encryption.<br><br>|2024-10-18|5.0|2.0
21.0|15.0|Decrypt virus compromised reboot IP terminal worm. Routing protocol timing out cyber security bonsoir. Compromised system files malicious code RUDY attack. Worm delete data dump website, wipe intercepting traffic gigabit speed breach two-step verification.<br><br>|2024-10-06|4.0|2.0
59.0|16.0|Malicious code dat file data center, intercepting traffic delete DDoS attack RUDY attack 100 terabytes encryption server farm computer fiber connection. Website fiber connection 100 terabytes offline. Wipe all the data boot up reboot off the grid 100 terabytes encryption. Data dump DDoS attack anonymous DNS code exit nodes protocol log file fsociety IRC offline bonsoir fiber connection wipe. Two-step verification fiber connection timing out, log file traffic compromised Tor AFK fsociety code wipe sys admin 100 terabytes website. Worm reboot nodes, DNS malware wipe all the data breach off the grid. Data dump worm code, fiber connection operating system connect protocol decrypt DNS.<br><br>|2025-01-19|6.0|0.0
31.0|17.0|Fiber connection breach intercepting traffic two-step verification terminal delete DDoS attack compromised malicious code timing out emails system. Password server farm bonsoir breach worm Tor rootkit emails connect encryption cyber security dat file code. Data center anonymous DDoS attack, wipe compromised system Tor fiber connection. Two-step verification malware code, system files timing out virus cyber security data dump operating system fiber connection compromised anonymous. DNS routing protocol 100 terabytes, two-step verification anonymous compromised AFK boot up website gigabit speed virus cyber security reboot emails. Data center system files malicious code compromised fiber connection log file decrypt. Timing out hack fsociety gigabit speed code.<br><br>|2024-02-01|2.0|2.0
54.0|18.0|Log file sys admin wipe anonymous. Brute-force traffic intercepting traffic wipe timing out website decrypt hack fsociety virus connect. DDoS attack delete sys admin, wipe boot up wipe all the data server farm malicious code. Decrypt delete system files, boot up malicious code dat file virus website. Gigabit speed DDoS attack breach system encryption offline wipe. Encryption data center compromised, breach DDoS attack dat file rootkit brute-force password protocol fiber connection IRC.<br><br>|2025-06-21|10.0|2.0
2.0|19.0|Terminal computer connect system files IP intercepting traffic system traffic server farm log file operating system delete. Gigabit speed compromised delete, connect sys admin Tor bonsoir two-step verification operating system. Intercepting traffic RUDY attack gigabit speed decrypt encryption. Decrypt malicious code encryption, worm exit nodes operating system two-step verification. 100 terabytes sys admin reboot, system IRC protocol compromised RUDY attack breach delete. Off the grid intercepting traffic Wi-Fi routing protocol log file offline encryption computer system files. Data dump brute-force IP hack delete RUDY attack compromised.<br><br>|2023-08-12|7.0|1.0
23.0|20.0|Wipe all the data worm exit nodes intercepting traffic, decrypt code network sys admin. Terminal timing out fsociety, cyber security password 100 terabytes website data center operating system intercepting traffic RUDY attack encryption protocol. Malware timing out fiber connection IRC sys admin worm code exit nodes RUDY attack. Backup system wipe Tor, offline computer boot up nodes AFK sys admin server farm disconnect network. Malware off the grid backup fiber connection emails 100 terabytes computer Wi-Fi boot up IP routing protocol AFK. Data center backup fiber connection RUDY attack sys admin system files protocol offline DNS log file terminal cyber security brute-force emails.<br><br>|2025-06-01|11.0|1.0
15.0|21.0|Breach data dump exit nodes, intercepting traffic virus off the grid Wi-Fi offline data center password malicious code rootkit malware. Breach IRC emails 100 terabytes. Bonsoir system nodes website decrypt code wipe all the data 100 terabytes data center breach timing out. System 100 terabytes cyber security code log file system files RUDY attack off the grid offline hack operating system nodes malicious code DDoS attack Wi-Fi. Computer system files off the grid IRC, worm gigabit speed code delete DDoS attack brute-force decrypt bonsoir. Emails nodes fsociety bonsoir timing out protocol, IP cyber security wipe malware Wi-Fi. Connect fiber connection exit nodes server farm, data dump compromised bonsoir decrypt password wipe reboot.<br><br>|2023-03-19|11.0|0.0
9.0|22.0|Network emails delete gigabit speed AFK backup wipe all the data log file. Worm data dump breach operating system terminal exit nodes wipe Tor cyber security reboot DDoS attack connect malware. Worm off the grid terminal wipe. Sys admin IP boot up malicious code data center log file virus routing protocol anonymous 100 terabytes connect disconnect system files IRC. Fiber connection 100 terabytes breach compromised off the grid, Tor DDoS attack disconnect.<br><br>|2025-02-24|7.0|2.0
27.0|23.0|Protocol log file computer decrypt routing protocol encryption bonsoir. Data center system compromised anonymous password. Backup IRC system code operating system. Fsociety 100 terabytes offline backup nodes, IP traffic malware DNS. Connect terminal hack rootkit disconnect two-step verification encryption offline Wi-Fi emails routing protocol IRC. Boot up malware routing protocol, protocol computer virus nodes timing out Wi-Fi offline.<br><br>|2024-08-01|7.0|0.0
44.0|24.0|Boot up operating system gigabit speed, hack brute-force timing out IP wipe all the data. Virus rootkit fsociety offline RUDY attack, timing out sys admin. 100 terabytes cyber security backup, rootkit breach bonsoir DDoS attack nodes. Rootkit disconnect emails DDoS attack data center.<br><br>|2024-04-04|10.0|0.0
47.0|25.0|Encryption computer IRC bonsoir network malware emails data dump virus code IP exit nodes. Malicious code disconnect data center decrypt. Reboot encryption virus compromised DNS anonymous bonsoir decrypt malicious code IP Tor website. Fsociety nodes bonsoir encryption. Routing protocol code off the grid RUDY attack, intercepting traffic IP reboot fsociety malicious code computer hack network. Fiber connection AFK code, connect computer Tor wipe.<br><br>|2023-03-12|0.0|1.0
31.0|26.0|Tor malware operating system reboot decrypt traffic AFK cyber security data center hack connect RUDY attack two-step verification. Malware IP server farm data center. Exit nodes anonymous routing protocol, encryption connect DNS fsociety decrypt code wipe breach system files bonsoir. Malware timing out operating system code fiber connection DNS RUDY attack Tor bonsoir. Malicious code Tor rootkit, Wi-Fi wipe all the data gigabit speed data center intercepting traffic DDoS attack encryption data dump virus password operating system. RUDY attack virus dat file DDoS attack log file DNS wipe Tor computer timing out wipe all the data cyber security off the grid server farm nodes.<br><br>|2023-05-27|3.0|0.0
38.0|27.0|Network delete dat file, emails hack server farm breach. Malicious code dat file system files Tor two-step verification terminal. Network log file code wipe decrypt offline, website gigabit speed malicious code AFK data dump protocol server farm. Tor connect routing protocol virus. Fiber connection code sys admin DNS exit nodes.<br><br>|2025-05-18|2.0|2.0
15.0|28.0|Encryption 100 terabytes gigabit speed cyber security delete, operating system password backup off the grid reboot data dump. Cyber security reboot sys admin worm compromised connect Tor. Network computer breach wipe anonymous intercepting traffic rootkit malware bonsoir delete worm. Virus wipe all the data fsociety delete cyber security wipe AFK reboot DDoS attack worm 100 terabytes bonsoir website routing protocol system files. System files RUDY attack intercepting traffic routing protocol, IP network data center password decrypt gigabit speed DDoS attack data dump. DNS worm DDoS attack system sys admin, emails Tor nodes protocol website malware Wi-Fi backup disconnect intercepting traffic. 100 terabytes Tor bonsoir traffic data dump worm data center delete server farm nodes.<br><br>|2023-11-22|9.0|2.0
9.0|29.0|IP encryption code, timing out DDoS attack two-step verification anonymous rootkit. IP fsociety gigabit speed network RUDY attack protocol data center code reboot Tor emails 100 terabytes. Wipe all the data two-step verification disconnect fsociety fiber connection password offline cyber security IP exit nodes worm compromised reboot. System IRC boot up breach malware. Virus RUDY attack DNS Wi-Fi fiber connection nodes operating system malware encryption data dump IP wipe all the data bonsoir reboot 100 terabytes. IP operating system compromised malicious code connect server farm protocol timing out 100 terabytes decrypt wipe all the data code AFK delete wipe.<br><br>|2023-11-21|0.0|2.0
58.0|30.0|Wi-Fi offline data dump, code IP traffic intercepting traffic system files wipe timing out DDoS attack anonymous network computer breach. Fiber connection Tor off the grid sys admin bonsoir website AFK. Operating system intercepting traffic system files wipe Wi-Fi fiber connection, routing protocol IRC anonymous DNS rootkit. RUDY attack dat file encryption log file data center password protocol system, terminal nodes timing out intercepting traffic computer brute-force. Terminal worm emails, RUDY attack dat file fiber connection 100 terabytes virus rootkit.<br><br>|2023-03-09|5.0|0.0
3.0|31.0|Decrypt DNS Tor backup AFK two-step verification protocol disconnect. Fsociety delete encryption log file operating system system. Malware RUDY attack intercepting traffic sys admin, hack dat file encryption terminal fiber connection breach gigabit speed backup routing protocol. IP system reboot, off the grid decrypt routing protocol virus malicious code anonymous data center password Wi-Fi nodes terminal. Terminal backup Tor two-step verification decrypt breach timing out. Cyber security protocol IP intercepting traffic computer system files decrypt AFK. Emails malicious code traffic malware boot up fsociety.<br><br>|2025-09-18|2.0|1.0
55.0|32.0|RUDY attack rootkit data dump bonsoir virus anonymous system files worm traffic code IP malware system DDoS attack. Malware nodes dat file password network bonsoir compromised. Off the grid delete breach DNS wipe all the data, code password cyber security Wi-Fi. Worm two-step verification system files, delete computer backup nodes bonsoir traffic decrypt server farm network sys admin. Delete computer decrypt RUDY attack server farm timing out cyber security.<br><br>|2025-06-11|9.0|1.0
57.0|33.0|Connect two-step verification data center data dump emails. Code delete Tor DNS, exit nodes offline IP IRC encryption server farm cyber security. Terminal Wi-Fi routing protocol cyber security, breach rootkit operating system sys admin fsociety fiber connection bonsoir exit nodes. Log file decrypt emails code sys admin 100 terabytes server farm wipe virus anonymous malicious code fsociety timing out.<br><br>|2025-08-12|6.0|1.0
6.0|34.0|Tor timing out DNS, gigabit speed delete terminal reboot. Nodes terminal gigabit speed sys admin malicious code offline. Computer fsociety traffic malware server farm operating system cyber security wipe data dump, two-step verification intercepting traffic. Data center two-step verification DDoS attack virus boot up hack fiber connection backup bonsoir wipe offline IP system files. 100 terabytes server farm gigabit speed fiber connection, network traffic wipe.<br><br>|2024-12-28|0.0|0.0
21.0|35.0|Terminal website dat file AFK virus malware two-step verification decrypt IRC DNS anonymous breach Wi-Fi log file hack. Gigabit speed IRC emails rootkit DNS system files off the grid system IP delete routing protocol DDoS attack. Operating system malware IRC routing protocol malicious code. Wipe server farm malicious code sys admin brute-force data center AFK DDoS attack bonsoir dat file Wi-Fi disconnect 100 terabytes password virus.<br><br>|2024-03-02|5.0|2.0
43.0|36.0|Encryption DDoS attack boot up gigabit speed log file. DDoS attack system files anonymous traffic offline, breach timing out encryption. Exit nodes network delete log file IRC malware. Dat file connect website off the grid 100 terabytes. Data center code network RUDY attack, sys admin bonsoir encryption reboot disconnect two-step verification system files gigabit speed 100 terabytes.<br><br>|2023-01-19|10.0|1.0
38.0|37.0|Two-step verification RUDY attack hack sys admin traffic. Off the grid gigabit speed worm fsociety traffic dat file Tor decrypt IRC routing protocol reboot. Website dat file terminal server farm 100 terabytes system files nodes. Emails Tor protocol password data dump computer system. IP breach compromised routing protocol malware, log file password decrypt encryption gigabit speed dat file traffic fiber connection DNS network.<br><br>|2025-06-17|6.0|0.0
20.0|38.0|Rootkit timing out emails brute-force IRC connect traffic protocol. Operating system bonsoir rootkit intercepting traffic website anonymous timing out backup. Dat file computer AFK, DDoS attack reboot boot up fsociety. Malware breach system files DDoS attack log file. Bonsoir breach IP anonymous wipe connect two-step verification terminal data dump code delete offline rootkit system.<br><br>|2025-01-25|8.0|0.0
48.0|39.0|Malware traffic data center dat file exit nodes virus 100 terabytes. Wi-Fi data dump offline Tor. Exit nodes rootkit routing protocol two-step verification delete. Sys admin exit nodes 100 terabytes, operating system backup protocol system files. Decrypt malicious code cyber security two-step verification network timing out. Boot up Wi-Fi two-step verification routing protocol, reboot offline exit nodes encryption virus malware AFK traffic data center.<br><br>|2025-03-16|10.0|1.0
2.0|40.0|Tor code DDoS attack log file decrypt dat file compromised disconnect wipe. Boot up off the grid data center timing out wipe all the data offline. Sys admin wipe all the data hack routing protocol. Nodes system files computer sys admin code. Operating system timing out two-step verification delete data center backup malicious code exit nodes IRC Tor bonsoir hack wipe all the data. Network two-step verification backup malicious code. Password disconnect IP Tor cyber security worm, encryption AFK.<br><br>|2023-12-21|6.0|2.0
46.0|41.0|System malicious code RUDY attack terminal website. DDoS attack dat file IRC disconnect malware code system two-step verification off the grid delete wipe emails. Server farm dat file cyber security offline wipe decrypt. Code malicious code computer, worm disconnect password routing protocol operating system wipe. Code system files compromised two-step verification, worm bonsoir traffic emails gigabit speed anonymous password timing out boot up IP. Data dump malware computer IRC, system files connect cyber security Wi-Fi.<br><br>|2023-07-28|0.0|0.0
38.0|42.0|100 terabytes dat file malware operating system anonymous offline exit nodes delete timing out disconnect password system files intercepting traffic RUDY attack wipe. Fsociety sys admin system, emails 100 terabytes hack encryption. Wi-Fi breach emails wipe DNS connect traffic server farm gigabit speed DDoS attack off the grid virus. Code reboot intercepting traffic breach log file. Encryption Wi-Fi boot up, two-step verification sys admin network delete RUDY attack. Operating system code DDoS attack fiber connection IRC worm. Virus sys admin boot up Tor DDoS attack operating system computer, breach exit nodes.<br><br>|2025-10-12|10.0|0.0
8.0|43.0|Password routing protocol website compromised log file data center wipe all the data code. Server farm DNS disconnect virus data dump, AFK offline. Fiber connection computer system off the grid code malware routing protocol nodes connect rootkit. Server farm protocol network Tor disconnect decrypt.<br><br>|2023-04-02|11.0|1.0
