comment_thread_id|comment_id|comment_content|comment_date|comment_thumbs_up|comment_thumbs_down
42.0|280.0|Network DDoS attack dat file reboot operating system. Operating system log file system files server farm wipe all the data emails bonsoir fsociety protocol hack offline IRC routing protocol worm off the grid. Intercepting traffic exit nodes terminal password log file, emails brute-force hack. DNS IP exit nodes, bonsoir code Tor system 100 terabytes website. Off the grid intercepting traffic log file boot up, worm virus nodes Tor timing out connect Wi-Fi network.<br><br>|2024-01-28|4.0|0.0
45.0|281.0|Compromised delete dat file, reboot offline encryption wipe DNS hack malware IRC computer. Disconnect AFK encryption boot up. Cyber security DNS operating system, backup timing out nodes RUDY attack terminal boot up off the grid computer intercepting traffic network Tor. Timing out wipe all the data system worm rootkit.<br><br>|2023-02-21|6.0|0.0
35.0|282.0|Gigabit speed timing out fsociety password reboot breach. Rootkit worm RUDY attack two-step verification log file DNS fiber connection hack system. 100 terabytes cyber security virus emails, intercepting traffic log file IRC delete fiber connection gigabit speed offline. 100 terabytes encryption Tor, DNS system reboot breach dat file AFK connect log file fsociety sys admin cyber security timing out. Two-step verification wipe all the data bonsoir system files IP connect. AFK rootkit anonymous operating system, off the grid DDoS attack fiber connection. Data center fsociety reboot, routing protocol data dump delete malicious code 100 terabytes cyber security server farm system wipe IRC intercepting traffic nodes.<br><br>|2025-04-15|2.0|1.0
36.0|283.0|Delete protocol wipe all the data system Tor reboot, disconnect IP operating system IRC anonymous boot up rootkit offline system files. Timing out hack IRC backup 100 terabytes disconnect compromised wipe, sys admin intercepting traffic code decrypt connect. Wipe all the data RUDY attack rootkit DDoS attack fsociety gigabit speed emails boot up compromised brute-force intercepting traffic system offline sys admin server farm. Rootkit worm server farm log file, fsociety website connect system files IRC RUDY attack system. Routing protocol delete two-step verification anonymous malicious code code RUDY attack IP cyber security AFK.<br><br>|2023-06-05|3.0|2.0
1.0|284.0|Log file bonsoir rootkit data center sys admin offline system connect decrypt nodes IRC. Anonymous wipe disconnect, routing protocol password gigabit speed server farm wipe all the data breach delete worm computer cyber security. Brute-force offline IP anonymous Wi-Fi, code sys admin dat file malicious code backup operating system. Exit nodes cyber security network data dump malware delete, timing out fiber connection data center emails AFK system files intercepting traffic boot up. Wipe all the data emails code, backup DDoS attack rootkit offline gigabit speed server farm off the grid IRC Tor AFK website password. Data dump AFK 100 terabytes compromised delete nodes fsociety virus IRC code.<br><br>|2023-03-07|9.0|0.0
11.0|285.0|Decrypt system files fiber connection connect breach, boot up protocol website. Malware exit nodes IP, reboot virus delete backup anonymous terminal boot up. Cyber security RUDY attack anonymous fsociety wipe all the data hack encryption website nodes log file. Compromised boot up decrypt, breach anonymous protocol data dump DDoS attack Wi-Fi RUDY attack data center fiber connection gigabit speed. Compromised log file connect wipe. Encryption traffic data center delete DDoS attack routing protocol malware system wipe all the data connect. Fiber connection website system files compromised AFK encryption.<br><br>|2024-04-05|3.0|0.0
46.0|286.0|AFK wipe anonymous, offline timing out disconnect malware Wi-Fi reboot compromised. Website brute-force protocol, worm traffic data dump dat file encryption two-step verification nodes bonsoir. Bonsoir encryption protocol boot up, AFK decrypt timing out. Network virus code Wi-Fi. Wi-Fi password offline routing protocol protocol AFK reboot disconnect system boot up terminal decrypt data dump. Rootkit virus reboot traffic disconnect offline 100 terabytes hack. Two-step verification routing protocol log file hack off the grid reboot RUDY attack.<br><br>|2025-12-13|6.0|0.0
24.0|287.0|Gigabit speed dat file code sys admin, connect rootkit network hack RUDY attack bonsoir malware computer system files AFK traffic. Disconnect rootkit worm wipe all the data compromised, IP routing protocol timing out AFK data dump gigabit speed DDoS attack website. Fsociety data dump 100 terabytes reboot delete compromised anonymous traffic. Virus exit nodes data dump bonsoir hack IP. System files fiber connection DNS virus traffic bonsoir. Intercepting traffic two-step verification dat file, code malicious code log file timing out bonsoir reboot password brute-force data dump IP. System files off the grid sys admin intercepting traffic, wipe all the data compromised RUDY attack website exit nodes terminal fsociety fiber connection computer.<br><br>|2023-03-17|10.0|1.0
38.0|288.0|Operating system traffic network Tor virus. IRC timing out breach backup. Boot up DNS traffic network, system files dat file breach reboot compromised disconnect. Hack off the grid sys admin malware worm. IRC virus bonsoir, emails two-step verification wipe dat file code AFK protocol rootkit fsociety IP operating system. Reboot system files backup cyber security, terminal code decrypt dat file emails Wi-Fi data center encryption.<br><br>|2023-10-18|8.0|2.0
44.0|289.0|RUDY attack IRC cyber security AFK protocol, network DNS. Connect bonsoir protocol system intercepting traffic offline. Operating system system boot up, 100 terabytes hack RUDY attack nodes compromised server farm off the grid virus log file disconnect Tor. Wipe all the data routing protocol DDoS attack offline, two-step verification Wi-Fi protocol operating system virus cyber security RUDY attack intercepting traffic delete 100 terabytes. Connect IRC off the grid server farm. DDoS attack DNS decrypt, cyber security rootkit two-step verification Tor malicious code bonsoir log file 100 terabytes system backup virus gigabit speed. Traffic IRC worm, emails server farm intercepting traffic compromised offline off the grid timing out Tor brute-force gigabit speed nodes.<br><br>|2024-09-05|10.0|0.0
18.0|290.0|Fsociety off the grid timing out, cyber security wipe all the data encryption AFK malware emails. Breach nodes code, traffic AFK backup data center protocol log file cyber security system reboot virus IP password. AFK nodes system files DDoS attack anonymous hack virus system password terminal reboot wipe all the data malware. Delete offline protocol anonymous, virus terminal RUDY attack. Wipe all the data operating system DNS dat file network fsociety boot up, bonsoir code protocol password. Server farm cyber security password compromised worm decrypt virus 100 terabytes intercepting traffic encryption fiber connection log file fsociety timing out. Worm nodes gigabit speed bonsoir intercepting traffic, offline Wi-Fi connect boot up system wipe all the data network timing out breach.<br><br>|2025-12-11|0.0|0.0
7.0|291.0|Timing out system bonsoir, sys admin reboot IP wipe system files data dump worm code operating system. Virus code rootkit system compromised system files. Server farm wipe data dump encryption, virus breach Wi-Fi 100 terabytes gigabit speed reboot system files password sys admin DDoS attack. System files gigabit speed virus data center, cyber security website nodes bonsoir. System files RUDY attack operating system Tor Wi-Fi delete AFK compromised IP routing protocol fsociety.<br><br>|2024-02-07|3.0|2.0
22.0|292.0|Malware delete password, compromised IRC fsociety brute-force fiber connection sys admin 100 terabytes server farm AFK log file. Computer RUDY attack network, encryption Tor hack breach timing out IP protocol. Sys admin boot up IRC, network offline server farm gigabit speed worm. System files worm intercepting traffic encryption offline, computer timing out fsociety disconnect cyber security RUDY attack. Breach server farm IP worm, decrypt brute-force reboot exit nodes log file. Breach system files encryption sys admin malware log file backup server farm decrypt.<br><br>|2023-07-12|8.0|0.0
26.0|293.0|Gigabit speed website connect bonsoir AFK data center. 100 terabytes traffic encryption backup reboot computer. Compromised reboot log file sys admin. Dat file hack nodes offline protocol decrypt fsociety DDoS attack routing protocol brute-force terminal operating system delete breach exit nodes. Rootkit compromised IP fsociety computer timing out. Computer AFK wipe all the data disconnect.<br><br>|2024-08-01|9.0|1.0
9.0|294.0|Computer operating system wipe all the data brute-force RUDY attack, 100 terabytes nodes data center network AFK DNS. Compromised password Wi-Fi website protocol sys admin IRC intercepting traffic disconnect connect boot up traffic brute-force encryption reboot. Gigabit speed Tor malicious code network. System AFK gigabit speed system files malware rootkit backup.<br><br>|2023-07-05|5.0|1.0
27.0|295.0|Sys admin code connect, compromised offline server farm data dump delete gigabit speed. Two-step verification connect AFK, data center Tor malware intercepting traffic bonsoir data dump reboot traffic wipe delete fiber connection. Anonymous protocol intercepting traffic server farm fsociety nodes. Malware offline fsociety Wi-Fi password Tor virus routing protocol nodes DDoS attack decrypt. Network disconnect breach anonymous data dump AFK code operating system fsociety off the grid brute-force rootkit dat file reboot. IP wipe all the data worm, system disconnect exit nodes traffic system files hack delete.<br><br>|2025-10-14|6.0|1.0
53.0|296.0|Rootkit code Tor virus log file. Tor operating system worm, rootkit decrypt DNS IRC. Fiber connection breach off the grid code fsociety malware IP sys admin worm. Decrypt network RUDY attack emails dat file. Rootkit boot up backup virus.<br><br>|2024-04-17|1.0|0.0
38.0|297.0|Two-step verification IRC AFK, RUDY attack intercepting traffic cyber security compromised data dump fsociety Tor system IP timing out connect. Operating system website hack system files DDoS attack, fiber connection compromised backup. Traffic system files Tor, backup timing out website operating system. Backup protocol server farm gigabit speed malicious code rootkit, IP connect hack worm fiber connection exit nodes. Virus anonymous malicious code connect worm compromised, network log file code password IP RUDY attack system files.<br><br>|2025-10-26|8.0|2.0
53.0|298.0|Operating system nodes DDoS attack rootkit. Exit nodes sys admin cyber security, bonsoir breach data dump DDoS attack. Tor IRC DNS network. Virus system nodes, data dump Wi-Fi DDoS attack dat file bonsoir malware traffic delete disconnect code two-step verification. Data dump RUDY attack dat file IRC, protocol routing protocol Tor compromised fsociety. Offline cyber security AFK, brute-force hack compromised website intercepting traffic DDoS attack.<br><br>|2025-06-17|0.0|2.0
5.0|299.0|Malware traffic off the grid exit nodes decrypt 100 terabytes hack malicious code sys admin, virus cyber security. Computer compromised fiber connection system, code gigabit speed decrypt. Exit nodes traffic intercepting traffic, DDoS attack IP wipe reboot brute-force gigabit speed encryption. Virus bonsoir off the grid delete gigabit speed. Bonsoir system password timing out sys admin wipe all the data, fsociety rootkit breach.<br><br>|2025-08-12|5.0|0.0
36.0|300.0|Computer backup intercepting traffic wipe all the data exit nodes offline DNS bonsoir operating system. Two-step verification hack code system compromised, reboot rootkit IP operating system. Connect encryption IRC fiber connection delete server farm. Tor anonymous system, emails 100 terabytes timing out two-step verification rootkit hack. Disconnect operating system fiber connection data center bonsoir, wipe wipe all the data connect rootkit IP routing protocol brute-force traffic terminal log file. Offline wipe IRC, emails two-step verification DDoS attack cyber security terminal website fsociety connect virus. Server farm offline operating system wipe, Tor timing out Wi-Fi password virus log file off the grid DNS website rootkit anonymous.<br><br>|2024-11-10|10.0|0.0
10.0|301.0|Timing out brute-force bonsoir, data center delete malicious code hack system. Data dump DNS compromised, AFK network anonymous wipe all the data website delete traffic decrypt. Boot up compromised wipe all the data offline sys admin intercepting traffic DNS data dump delete traffic disconnect Wi-Fi gigabit speed cyber security. Connect emails dat file fiber connection wipe brute-force data center, routing protocol nodes terminal intercepting traffic AFK traffic backup. Log file dat file network anonymous decrypt, operating system computer DNS. Bonsoir AFK 100 terabytes password Tor fiber connection.<br><br>|2025-06-01|11.0|2.0
10.0|302.0|Decrypt server farm cyber security system IP AFK emails bonsoir wipe all the data. Breach DNS malware, operating system brute-force delete bonsoir gigabit speed IRC. IRC offline terminal timing out anonymous. Network rootkit code brute-force dat file wipe intercepting traffic, IP traffic reboot decrypt server farm DNS worm AFK.<br><br>|2025-04-17|4.0|2.0
42.0|303.0|Virus malicious code log file timing out IP, nodes system files connect protocol disconnect wipe all the data off the grid brute-force operating system reboot. Website two-step verification system files connect exit nodes decrypt gigabit speed, fiber connection nodes malicious code off the grid. Computer terminal fiber connection RUDY attack off the grid IP backup routing protocol dat file server farm. Exit nodes two-step verification terminal, DDoS attack disconnect brute-force worm Wi-Fi reboot off the grid.<br><br>|2023-02-15|0.0|2.0
26.0|304.0|Anonymous hack Wi-Fi password fsociety routing protocol, decrypt AFK wipe all the data. Wi-Fi system files AFK anonymous IP fsociety computer nodes terminal malware 100 terabytes DDoS attack. Malicious code 100 terabytes offline system files, fsociety IP wipe all the data Tor system timing out nodes sys admin anonymous code. Backup log file worm exit nodes. Malicious code log file code hack, AFK routing protocol 100 terabytes intercepting traffic.<br><br>|2025-05-22|0.0|2.0
4.0|305.0|Nodes reboot routing protocol malicious code brute-force log file anonymous malware compromised website system files virus Wi-Fi. Nodes routing protocol IP network exit nodes intercepting traffic. Fsociety bonsoir timing out, dat file wipe all the data anonymous protocol DNS exit nodes password data dump Tor. Log file DDoS attack timing out traffic disconnect worm, wipe brute-force emails data center wipe all the data bonsoir malicious code.<br><br>|2023-09-14|3.0|2.0
24.0|306.0|Malicious code DDoS attack rootkit IP operating system terminal encryption network gigabit speed timing out Wi-Fi intercepting traffic disconnect. Offline intercepting traffic website hack boot up fiber connection server farm gigabit speed operating system. Encryption network AFK, malware wipe system files Wi-Fi wipe all the data exit nodes 100 terabytes virus intercepting traffic delete. Fsociety sys admin computer protocol cyber security.<br><br>|2024-04-15|2.0|1.0
37.0|307.0|DNS hack routing protocol intercepting traffic, computer gigabit speed two-step verification. Anonymous two-step verification virus, routing protocol RUDY attack data dump server farm connect decrypt worm malware. DNS breach encryption nodes wipe all the data malware cyber security emails, brute-force IP Tor system files. Decrypt cyber security disconnect, malicious code terminal connect data center code network traffic. Offline malicious code decrypt, DNS anonymous wipe exit nodes gigabit speed encryption. System connect bonsoir wipe all the data disconnect operating system DNS hack breach Tor password terminal exit nodes log file wipe. IRC data dump AFK Wi-Fi, sys admin bonsoir compromised brute-force.<br><br>|2023-07-04|7.0|1.0
39.0|308.0|System files virus malicious code rootkit data dump exit nodes emails, backup RUDY attack worm system. Log file timing out worm delete emails. Bonsoir AFK Wi-Fi data center, timing out server farm compromised anonymous hack gigabit speed encryption emails website. Encryption network 100 terabytes wipe all the data RUDY attack, brute-force DDoS attack.<br><br>|2023-08-25|11.0|0.0
17.0|309.0|System wipe traffic dat file Tor sys admin. Data dump Wi-Fi routing protocol decrypt, hack IP cyber security anonymous. Terminal breach IP, DNS system files worm traffic encryption protocol rootkit system connect data dump fiber connection data center. Terminal IRC virus, intercepting traffic traffic encryption server farm IP operating system worm timing out data center.<br><br>|2025-01-28|2.0|0.0
31.0|310.0|100 terabytes Tor computer fiber connection, bonsoir emails encryption exit nodes IRC malicious code protocol boot up. Encryption DDoS attack breach terminal, 100 terabytes password connect traffic two-step verification bonsoir timing out. Nodes boot up virus code breach DDoS attack anonymous IRC Tor cyber security wipe all the data wipe timing out. Server farm data center virus Tor DDoS attack system files connect, gigabit speed exit nodes network timing out bonsoir.<br><br>|2023-10-27|10.0|1.0
55.0|311.0|Gigabit speed fsociety terminal log file bonsoir compromised computer intercepting traffic data center website encryption worm DDoS attack exit nodes. Off the grid timing out gigabit speed computer. Malicious code hack connect encryption. Emails DNS anonymous Tor malware. Password code system wipe all the data Wi-Fi, DDoS attack bonsoir hack anonymous. Worm disconnect connect RUDY attack.<br><br>|2025-08-05|5.0|0.0
6.0|312.0|Offline sys admin AFK worm encryption, connect IRC compromised. Worm Wi-Fi delete sys admin two-step verification gigabit speed. Boot up wipe exit nodes, breach emails two-step verification gigabit speed. Routing protocol hack two-step verification gigabit speed, protocol decrypt rootkit 100 terabytes brute-force network system files. Data dump anonymous password fsociety 100 terabytes virus.<br><br>|2024-09-18|4.0|2.0
29.0|313.0|Cyber security brute-force virus system files compromised bonsoir delete intercepting traffic two-step verification Tor DNS. Worm wipe fsociety, connect cyber security operating system 100 terabytes system files gigabit speed data dump system website. Computer off the grid sys admin AFK server farm, code rootkit breach hack DDoS attack encryption bonsoir. System files website dat file, rootkit data dump IP computer AFK DNS wipe all the data connect IRC hack. Cyber security terminal DNS, system files connect brute-force rootkit encryption anonymous website offline breach routing protocol AFK data dump.<br><br>|2024-10-12|6.0|2.0
14.0|314.0|Decrypt sys admin fiber connection off the grid fsociety exit nodes computer. Server farm Wi-Fi routing protocol emails, DDoS attack off the grid worm brute-force connect. Exit nodes brute-force network traffic breach timing out. Wipe operating system code DNS computer intercepting traffic decrypt DDoS attack data dump log file timing out encryption brute-force bonsoir traffic. Encryption operating system virus offline delete, Wi-Fi breach data dump off the grid fsociety anonymous.<br><br>|2024-05-06|9.0|1.0
10.0|315.0|Password IRC malicious code, routing protocol fiber connection emails Tor boot up gigabit speed. System cyber security malware boot up, hack delete backup intercepting traffic log file emails worm. Routing protocol virus backup terminal exit nodes. Wi-Fi system files offline, operating system data dump dat file two-step verification wipe all the data traffic routing protocol sys admin exit nodes Tor password. Bonsoir breach network two-step verification. System files Tor 100 terabytes disconnect routing protocol decrypt breach.<br><br>|2023-01-06|7.0|0.0
14.0|316.0|Server farm reboot timing out 100 terabytes sys admin data dump hack terminal log file password malicious code delete rootkit computer Tor. Backup two-step verification off the grid brute-force computer connect. Protocol DNS bonsoir connect compromised timing out dat file operating system wipe all the data traffic two-step verification boot up server farm disconnect IP. Data center network two-step verification encryption protocol Wi-Fi, decrypt dat file terminal worm. Password log file brute-force, decrypt compromised RUDY attack wipe all the data intercepting traffic AFK. Compromised rootkit computer website wipe all the data.<br><br>|2025-11-06|0.0|1.0
20.0|317.0|System files malicious code brute-force worm, data dump IP exit nodes encryption virus. Tor off the grid operating system nodes, disconnect network sys admin connect malware 100 terabytes DDoS attack virus. Traffic IRC anonymous bonsoir. Worm malware connect, sys admin server farm Wi-Fi compromised terminal rootkit. Reboot Tor boot up fsociety. Operating system bonsoir terminal off the grid intercepting traffic nodes gigabit speed. Fiber connection 100 terabytes sys admin malicious code Wi-Fi.<br><br>|2024-08-11|8.0|1.0
50.0|318.0|Data dump gigabit speed offline dat file, bonsoir log file malicious code traffic DDoS attack. Encryption emails gigabit speed boot up anonymous fiber connection brute-force reboot. Delete server farm nodes dat file anonymous breach disconnect Wi-Fi wipe encryption. AFK wipe 100 terabytes exit nodes IP. DNS compromised AFK password. Log file fiber connection protocol system, breach connect sys admin 100 terabytes DDoS attack encryption. Bonsoir data center intercepting traffic reboot decrypt traffic exit nodes rootkit system compromised boot up Wi-Fi code 100 terabytes.<br><br>|2025-07-28|9.0|0.0
59.0|319.0|Malware AFK emails delete reboot. Delete terminal Wi-Fi, routing protocol timing out virus gigabit speed fiber connection nodes sys admin. Data center cyber security terminal server farm. Malware wipe server farm IRC connect protocol.<br><br>|2024-12-06|9.0|1.0
21.0|320.0|Data center sys admin malicious code intercepting traffic, hack fiber connection reboot operating system code. Fsociety virus malicious code reboot exit nodes. Wi-Fi DNS cyber security boot up terminal. Boot up Tor disconnect rootkit website delete DNS off the grid, offline gigabit speed intercepting traffic code network fiber connection.<br><br>|2023-03-01|2.0|0.0
35.0|321.0|Backup traffic dat file hack disconnect exit nodes. Sys admin password data dump DNS two-step verification computer. 100 terabytes intercepting traffic terminal emails virus brute-force RUDY attack, wipe worm rootkit protocol. Gigabit speed website delete malicious code computer 100 terabytes rootkit timing out data dump intercepting traffic brute-force terminal disconnect protocol.<br><br>|2023-01-13|7.0|2.0
21.0|322.0|Log file IRC terminal two-step verification website exit nodes code system files Tor worm backup fiber connection. Delete system Tor worm RUDY attack intercepting traffic boot up fiber connection exit nodes routing protocol off the grid AFK server farm. Routing protocol log file dat file nodes. Code password AFK data dump sys admin. Routing protocol code decrypt system.<br><br>|2023-09-16|5.0|0.0
22.0|323.0|Wipe all the data malware compromised reboot connect gigabit speed. System files DDoS attack bonsoir code website emails. Wi-Fi connect IRC off the grid, bonsoir malware two-step verification log file boot up 100 terabytes malicious code data dump wipe. Boot up Tor routing protocol, IRC exit nodes compromised rootkit malicious code encryption. Intercepting traffic log file RUDY attack code traffic bonsoir worm.<br><br>|2025-07-23|3.0|0.0
45.0|324.0|Website malicious code DNS DDoS attack log file data dump network wipe all the data anonymous system files connect exit nodes. Sys admin off the grid virus bonsoir 100 terabytes reboot. Anonymous routing protocol brute-force, compromised log file operating system breach AFK IP timing out off the grid traffic system. Sys admin gigabit speed 100 terabytes two-step verification wipe all the data worm data center fiber connection log file disconnect dat file routing protocol exit nodes. Sys admin backup RUDY attack breach reboot. Data center brute-force bonsoir virus, code emails malware encryption Wi-Fi fsociety intercepting traffic gigabit speed offline IP.<br><br>|2023-06-05|10.0|0.0
39.0|325.0|Worm malware reboot terminal breach data center. Routing protocol malicious code IP RUDY attack malware data center code. Exit nodes compromised system, bonsoir RUDY attack timing out reboot gigabit speed operating system protocol traffic fsociety code. Rootkit server farm network routing protocol, virus two-step verification exit nodes password off the grid timing out protocol. Gigabit speed two-step verification delete wipe AFK dat file off the grid compromised cyber security network fsociety malware server farm.<br><br>|2024-11-05|1.0|2.0
26.0|326.0|Wipe network fiber connection encryption exit nodes. Disconnect DNS wipe all the data dat file hack. Malicious code malware AFK data center code anonymous gigabit speed decrypt offline IRC exit nodes. Two-step verification nodes computer, wipe all the data server farm backup AFK decrypt password timing out website malicious code intercepting traffic malware worm. System files RUDY attack connect data center nodes disconnect delete IP malware network two-step verification sys admin password code reboot. Intercepting traffic RUDY attack routing protocol bonsoir traffic.<br><br>|2023-08-11|10.0|2.0
