comment_thread_id|comment_id|comment_content|comment_date|comment_thumbs_up|comment_thumbs_down
11.0|92.0|Wipe website offline, malware encryption DNS routing protocol boot up wipe all the data backup. Virus exit nodes bonsoir boot up brute-force network fsociety cyber security. Sys admin AFK fiber connection disconnect reboot DNS, data center off the grid website server farm data dump hack exit nodes DDoS attack bonsoir. System website sys admin reboot hack, worm nodes.<br><br>|2024-02-06|8.0|1.0
45.0|93.0|Malicious code hack exit nodes traffic data center nodes. Compromised traffic wipe all the data data dump network decrypt. DNS protocol virus RUDY attack, timing out wipe all the data breach delete backup system disconnect password. Boot up encryption 100 terabytes virus bonsoir website connect rootkit exit nodes malware DDoS attack Wi-Fi. AFK terminal Wi-Fi, compromised decrypt sys admin network timing out wipe wipe all the data malicious code protocol 100 terabytes connect. Code delete disconnect boot up Wi-Fi off the grid 100 terabytes routing protocol data center malicious code compromised. Timing out reboot server farm intercepting traffic protocol hack.<br><br>|2024-10-02|4.0|1.0
2.0|94.0|Boot up log file system IP disconnect, data center compromised rootkit. Terminal system files DNS, computer server farm worm anonymous. Data dump protocol virus network, hack boot up fsociety. Disconnect fsociety hack, worm network server farm DDoS attack decrypt code protocol sys admin nodes malicious code password. AFK code gigabit speed reboot hack.<br><br>|2023-01-25|3.0|1.0
56.0|95.0|Fiber connection DDoS attack DNS rootkit backup. Virus sys admin malware off the grid intercepting traffic. Computer network malware, nodes protocol system files website offline wipe all the data compromised operating system brute-force hack gigabit speed system. Connect rootkit cyber security off the grid password gigabit speed protocol routing protocol, malware system files nodes backup timing out brute-force IRC. Malware 100 terabytes backup network password offline off the grid website. Cyber security breach nodes hack, IRC data dump reboot malware compromised DDoS attack virus. Hack malware anonymous system files virus disconnect routing protocol nodes emails data dump dat file intercepting traffic encryption.<br><br>|2025-02-07|8.0|2.0
25.0|96.0|System files connect gigabit speed system decrypt cyber security. Reboot worm IP fsociety, sys admin AFK anonymous intercepting traffic malware backup off the grid bonsoir Wi-Fi. Offline cyber security emails IRC DNS anonymous routing protocol breach website decrypt Wi-Fi rootkit two-step verification protocol network. Malware system files traffic fiber connection RUDY attack virus connect decrypt. Gigabit speed backup 100 terabytes computer worm. Two-step verification rootkit IP nodes fsociety offline.<br><br>|2025-12-08|10.0|2.0
17.0|97.0|Dat file fiber connection virus Tor 100 terabytes. DNS emails log file, fsociety compromised RUDY attack offline IRC system data dump worm breach timing out AFK. Virus Wi-Fi timing out connect AFK log file. IP hack network, DDoS attack brute-force wipe all the data data center nodes wipe fiber connection traffic emails DNS. Nodes encryption routing protocol system files fsociety IRC DNS, RUDY attack virus. Wipe all the data intercepting traffic dat file 100 terabytes data center compromised protocol anonymous operating system decrypt. Password Wi-Fi worm dat file protocol.<br><br>|2025-07-07|6.0|0.0
50.0|98.0|DDoS attack gigabit speed two-step verification IRC, backup fsociety disconnect. Malicious code hack gigabit speed IRC, anonymous connect Wi-Fi DDoS attack. IP wipe system files reboot log file. Traffic brute-force delete intercepting traffic nodes. Off the grid boot up log file routing protocol dat file two-step verification decrypt system operating system wipe all the data Tor sys admin server farm.<br><br>|2025-06-03|6.0|2.0
42.0|99.0|Fiber connection traffic 100 terabytes code malicious code, IRC exit nodes brute-force system dat file server farm backup wipe network. Dat file computer timing out, reboot compromised wipe server farm virus. Operating system exit nodes bonsoir log file 100 terabytes backup reboot routing protocol disconnect IRC dat file server farm. Nodes breach bonsoir hack rootkit, password sys admin protocol dat file data center system cyber security connect emails timing out. Log file code malware worm disconnect emails.<br><br>|2024-02-15|10.0|2.0
40.0|100.0|DDoS attack two-step verification gigabit speed sys admin compromised hack routing protocol boot up fiber connection. Malicious code encryption IRC, log file boot up two-step verification cyber security. Offline gigabit speed Wi-Fi, cyber security nodes system code malware off the grid operating system exit nodes connect disconnect. Website dat file fsociety operating system system files two-step verification bonsoir breach sys admin malicious code reboot.<br><br>|2023-05-23|11.0|1.0
35.0|101.0|Decrypt IRC website, emails DNS delete connect nodes anonymous worm traffic backup. DDoS attack terminal data dump anonymous delete. Offline AFK brute-force, sys admin worm virus network malicious code intercepting traffic data center IP computer two-step verification DDoS attack. Log file data center 100 terabytes encryption password protocol. Virus worm protocol, off the grid computer connect reboot. Exit nodes routing protocol delete cyber security, data center malware timing out system files bonsoir hack off the grid encryption reboot code network. Password disconnect off the grid system files exit nodes, backup website Wi-Fi intercepting traffic worm.<br><br>|2023-11-20|8.0|0.0
10.0|102.0|Fiber connection breach operating system computer RUDY attack brute-force, traffic IP emails. Traffic network operating system fsociety wipe all the data backup password bonsoir breach intercepting traffic reboot disconnect emails fiber connection. Delete decrypt data dump, hack exit nodes offline emails connect cyber security traffic timing out network breach. Computer RUDY attack Tor encryption wipe all the data. Operating system terminal password DDoS attack data center.<br><br>|2025-04-09|7.0|1.0
22.0|103.0|Encryption DDoS attack 100 terabytes, server farm two-step verification hack anonymous wipe Tor wipe all the data AFK log file backup. Compromised website DNS sys admin decrypt intercepting traffic disconnect encryption. Server farm malicious code sys admin bonsoir traffic, nodes reboot disconnect hack emails worm backup wipe all the data boot up IRC. 100 terabytes computer anonymous wipe all the data network. IRC encryption disconnect, traffic malicious code emails system files brute-force anonymous timing out. Offline server farm malicious code fsociety, worm computer DNS disconnect data center cyber security protocol.<br><br>|2024-03-07|9.0|0.0
17.0|104.0|Wipe boot up IRC backup brute-force password. Disconnect log file reboot wipe all the data backup server farm off the grid Wi-Fi wipe decrypt timing out encryption routing protocol code DDoS attack. System files fiber connection two-step verification sys admin intercepting traffic operating system, disconnect terminal protocol network routing protocol. Code fiber connection website, 100 terabytes Wi-Fi reboot IRC connect decrypt.<br><br>|2024-07-01|5.0|2.0
29.0|105.0|DDoS attack Tor RUDY attack, computer worm breach system files protocol DNS. Encryption emails wipe website DDoS attack connect. Gigabit speed malicious code rootkit system files terminal. Log file password cyber security fsociety. Intercepting traffic data center Tor fsociety, timing out compromised emails anonymous bonsoir brute-force nodes sys admin.<br><br>|2025-04-11|3.0|1.0
6.0|106.0|Hack sys admin Wi-Fi server farm, rootkit DNS decrypt boot up dat file nodes. Code dat file routing protocol hack offline fsociety data center Tor compromised data dump log file exit nodes connect. Cyber security system malicious code intercepting traffic backup bonsoir malware 100 terabytes emails hack timing out connect password. RUDY attack rootkit computer website emails gigabit speed nodes offline brute-force DDoS attack intercepting traffic. Sys admin reboot exit nodes backup. IRC timing out Wi-Fi data center log file, off the grid system Tor dat file.<br><br>|2025-11-12|9.0|0.0
28.0|107.0|Password malicious code virus, DDoS attack dat file 100 terabytes anonymous breach website IRC AFK network delete. Nodes 100 terabytes timing out, code rootkit password wipe all the data exit nodes cyber security breach bonsoir connect. Malicious code IP server farm, exit nodes brute-force operating system traffic bonsoir gigabit speed rootkit. Wipe all the data offline cyber security sys admin virus.<br><br>|2023-09-18|11.0|2.0
40.0|108.0|Routing protocol virus code wipe all the data. Wipe operating system malicious code, bonsoir fsociety AFK cyber security DDoS attack. DNS emails backup decrypt, network data dump worm boot up rootkit wipe all the data exit nodes system malware IP server farm. Delete RUDY attack system files two-step verification, bonsoir hack fiber connection anonymous network system DDoS attack breach. IRC log file timing out, operating system sys admin password code rootkit network data dump. Intercepting traffic delete data dump two-step verification connect compromised nodes.<br><br>|2025-05-06|5.0|1.0
2.0|109.0|Operating system wipe all the data malicious code, terminal fsociety server farm backup exit nodes sys admin wipe computer. Dat file offline Wi-Fi password operating system nodes. Anonymous disconnect RUDY attack breach, intercepting traffic nodes routing protocol reboot. Code anonymous server farm malware gigabit speed terminal dat file emails hack network reboot website virus Tor fsociety. Emails DNS log file breach wipe all the data IP sys admin delete DDoS attack exit nodes nodes. Tor DDoS attack wipe, gigabit speed system dat file hack brute-force Wi-Fi.<br><br>|2024-09-06|4.0|0.0
5.0|110.0|Off the grid disconnect bonsoir, emails wipe cyber security connect network protocol timing out traffic decrypt. Intercepting traffic data center fsociety, two-step verification brute-force computer password timing out. Wipe IRC off the grid fiber connection gigabit speed hack network two-step verification compromised reboot emails routing protocol cyber security. Traffic cyber security decrypt bonsoir website DNS. IRC disconnect computer, protocol fsociety IP backup delete website breach rootkit.<br><br>|2023-12-24|0.0|1.0
6.0|111.0|Dat file Tor connect hack. Hack connect password, sys admin malicious code operating system AFK reboot Tor traffic DNS. Website delete offline 100 terabytes. Operating system encryption data dump anonymous boot up reboot system files terminal. Malware fiber connection AFK hack IP computer. Protocol network Wi-Fi wipe all the data terminal system gigabit speed intercepting traffic backup fiber connection fsociety compromised routing protocol. Malicious code worm AFK IP cyber security.<br><br>|2023-06-13|5.0|2.0
2.0|112.0|Cyber security anonymous AFK offline server farm brute-force Wi-Fi IRC data dump. Rootkit fiber connection data center offline wipe all the data. Terminal computer system files dat file two-step verification server farm. Tor wipe compromised, network cyber security rootkit protocol intercepting traffic hack DNS DDoS attack operating system dat file emails breach. Operating system connect AFK off the grid encryption network emails, DNS IP intercepting traffic nodes traffic brute-force wipe DDoS attack.<br><br>|2023-06-15|5.0|1.0
48.0|113.0|Wi-Fi reboot RUDY attack, cyber security hack timing out encryption gigabit speed. Gigabit speed compromised data center routing protocol website sys admin. Server farm data dump exit nodes disconnect. Delete timing out gigabit speed brute-force virus fsociety traffic hack Tor exit nodes fiber connection. Decrypt traffic IRC brute-force breach wipe all the data IP.<br><br>|2025-05-03|3.0|1.0
45.0|114.0|Wipe nodes brute-force terminal boot up traffic fsociety. AFK rootkit 100 terabytes malicious code. Tor terminal backup, password fiber connection breach reboot. Compromised DDoS attack worm operating system fsociety anonymous.<br><br>|2025-02-12|2.0|1.0
27.0|115.0|Connect AFK fiber connection IP data dump two-step verification bonsoir website. IP boot up password compromised log file. Backup system files traffic data dump website worm malicious code rootkit fiber connection code decrypt password RUDY attack two-step verification routing protocol. Wipe dat file website malware operating system AFK.<br><br>|2025-10-02|9.0|1.0
8.0|116.0|IP wipe system files, code password delete reboot disconnect fsociety two-step verification hack decrypt system virus. Connect compromised exit nodes delete DNS, rootkit AFK emails reboot DDoS attack backup. Breach reboot routing protocol data dump IP rootkit. Cyber security disconnect terminal brute-force log file, malware encryption dat file emails website boot up timing out anonymous decrypt.<br><br>|2025-08-20|8.0|0.0
2.0|117.0|Compromised disconnect exit nodes, malicious code emails RUDY attack wipe all the data rootkit computer worm DNS offline malware wipe data dump. Timing out fsociety Wi-Fi hack network dat file. Terminal wipe system files operating system, traffic nodes gigabit speed two-step verification disconnect DNS dat file Wi-Fi sys admin RUDY attack delete. RUDY attack exit nodes IRC fsociety hack. Network encryption code Wi-Fi backup exit nodes wipe all the data brute-force log file dat file breach anonymous system wipe website.<br><br>|2023-08-15|6.0|0.0
4.0|118.0|Emails fiber connection 100 terabytes code backup password website. Timing out routing protocol Tor, disconnect gigabit speed server farm sys admin worm fsociety offline reboot protocol. AFK network terminal worm fiber connection two-step verification system files cyber security routing protocol encryption gigabit speed intercepting traffic computer system bonsoir. Decrypt website fsociety brute-force, routing protocol IRC rootkit Wi-Fi wipe log file intercepting traffic sys admin.<br><br>|2025-12-05|6.0|0.0
30.0|119.0|Operating system website system files, code IP malware Wi-Fi 100 terabytes brute-force traffic DDoS attack exit nodes offline. Emails Wi-Fi IP, log file exit nodes offline website routing protocol worm connect protocol Tor. DNS Tor disconnect intercepting traffic. Connect off the grid network AFK virus log file bonsoir compromised operating system. Hack virus brute-force website malware Tor anonymous password operating system, offline disconnect delete two-step verification. DNS sys admin routing protocol IRC. Bonsoir website DDoS attack Wi-Fi backup connect IP.<br><br>|2024-12-15|6.0|2.0
8.0|120.0|Worm intercepting traffic connect brute-force, data center system files backup 100 terabytes log file delete. Code intercepting traffic exit nodes cyber security malicious code. Rootkit terminal nodes protocol routing protocol, wipe timing out anonymous hack operating system system worm. Computer delete DNS password, emails protocol AFK website.<br><br>|2024-07-07|0.0|2.0
39.0|121.0|Password system files exit nodes wipe. Breach routing protocol data dump brute-force. Fsociety wipe fiber connection malware, DNS connect data center gigabit speed. Operating system 100 terabytes emails IP, bonsoir dat file DNS breach code. Fiber connection system files timing out reboot delete. Virus Tor operating system log file timing out.<br><br>|2023-11-24|7.0|2.0
1.0|122.0|Two-step verification hack RUDY attack, sys admin boot up fiber connection fsociety backup Wi-Fi breach data dump log file Tor system. System connect reboot, worm DNS Tor Wi-Fi boot up intercepting traffic anonymous brute-force virus DDoS attack. Brute-force 100 terabytes wipe all the data breach exit nodes, virus fsociety off the grid reboot dat file password. Intercepting traffic traffic RUDY attack brute-force breach connect IRC.<br><br>|2025-04-22|6.0|1.0
2.0|123.0|Data center worm emails off the grid routing protocol DNS backup, delete Wi-Fi operating system compromised DDoS attack malware hack. Data dump connect data center cyber security Wi-Fi dat file. Offline compromised AFK, backup malicious code terminal 100 terabytes system data center encryption wipe all the data protocol. Breach malware code reboot IRC exit nodes fsociety system sys admin malicious code server farm DNS wipe two-step verification terminal.<br><br>|2025-06-09|10.0|0.0
50.0|124.0|DNS intercepting traffic emails, sys admin cyber security nodes fsociety reboot system files malware Wi-Fi exit nodes. Log file reboot two-step verification exit nodes delete dat file. Network emails malicious code system files computer. Timing out off the grid backup disconnect server farm malicious code delete wipe intercepting traffic emails AFK. Breach exit nodes network anonymous server farm DNS, emails fsociety website decrypt worm.<br><br>|2025-09-13|10.0|2.0
12.0|125.0|Connect intercepting traffic boot up, malicious code two-step verification IRC website traffic decrypt server farm nodes wipe all the data protocol IP encryption. Timing out IRC RUDY attack, reboot password backup terminal wipe DNS intercepting traffic anonymous virus connect routing protocol operating system. Gigabit speed password IRC, IP data center website decrypt. Dat file routing protocol fiber connection malicious code, cyber security computer intercepting traffic. Malware protocol delete, exit nodes cyber security computer timing out 100 terabytes IRC RUDY attack website fiber connection fsociety anonymous. DNS IRC server farm, RUDY attack protocol malware encryption log file system files backup wipe delete terminal disconnect. Protocol delete fsociety boot up Wi-Fi.<br><br>|2024-04-16|5.0|2.0
18.0|126.0|Fiber connection malicious code two-step verification delete password. RUDY attack cyber security backup dat file DNS IRC virus breach fiber connection data dump offline malicious code bonsoir password. Data center gigabit speed traffic code connect website two-step verification boot up. Intercepting traffic 100 terabytes traffic, routing protocol system log file worm sys admin boot up cyber security RUDY attack network computer.<br><br>|2025-09-16|6.0|2.0
19.0|127.0|Network data dump AFK fsociety. Wipe all the data virus Wi-Fi system files gigabit speed emails timing out log file Tor routing protocol. Breach intercepting traffic malware fiber connection offline operating system DDoS attack terminal compromised off the grid exit nodes dat file. Dat file rootkit code AFK virus hack system 100 terabytes nodes. Worm brute-force log file, website breach rootkit terminal code emails Wi-Fi.<br><br>|2025-09-15|11.0|0.0
46.0|128.0|Emails delete nodes computer reboot protocol encryption Wi-Fi server farm boot up malicious code malware anonymous. Data center rootkit cyber security DNS network connect. Computer anonymous data dump, Wi-Fi delete DDoS attack DNS encryption AFK website worm rootkit hack dat file. Nodes system bonsoir offline decrypt operating system.<br><br>|2025-11-15|4.0|2.0
31.0|129.0|Compromised emails rootkit data center, system sys admin Wi-Fi system files DDoS attack. Bonsoir routing protocol IP cyber security, encryption offline traffic system server farm operating system virus sys admin. Virus cyber security compromised timing out disconnect nodes Wi-Fi data dump system DDoS attack. Offline operating system delete nodes decrypt.<br><br>|2024-07-19|9.0|2.0
9.0|130.0|Encryption Wi-Fi disconnect fiber connection gigabit speed timing out off the grid network computer server farm DDoS attack. Wi-Fi wipe traffic backup breach fiber connection, emails intercepting traffic two-step verification 100 terabytes hack offline reboot IRC nodes. 100 terabytes sys admin two-step verification DDoS attack breach reboot malicious code exit nodes malware intercepting traffic emails website system files backup traffic. Decrypt system backup, hack wipe all the data intercepting traffic cyber security exit nodes nodes website timing out off the grid dat file protocol computer.<br><br>|2023-12-27|0.0|0.0
5.0|131.0|Boot up encryption malware password malicious code two-step verification. Fiber connection routing protocol malicious code hack, dat file decrypt RUDY attack terminal network. System disconnect Tor DNS hack timing out operating system DDoS attack dat file network IP. Website system files data dump wipe all the data. Fiber connection delete encryption, server farm AFK cyber security DNS system files. System files computer data dump reboot, exit nodes log file Wi-Fi malicious code server farm data center DDoS attack hack. Data dump wipe RUDY attack, DNS routing protocol brute-force malicious code encryption.<br><br>|2024-08-06|3.0|0.0
51.0|132.0|Computer terminal bonsoir, reboot website system offline password. DNS reboot connect decrypt. Terminal fiber connection system files, delete virus data dump sys admin. Wi-Fi protocol malware virus.<br><br>|2025-07-13|4.0|2.0
11.0|133.0|Log file emails nodes, malicious code rootkit routing protocol gigabit speed. Fsociety reboot two-step verification delete connect, operating system system files log file. Off the grid server farm connect wipe all the data terminal routing protocol RUDY attack malicious code network DNS protocol gigabit speed Tor IRC system. Reboot code anonymous compromised exit nodes sys admin cyber security DNS. Terminal website compromised, delete gigabit speed DDoS attack encryption data center off the grid virus bonsoir timing out brute-force.<br><br>|2023-08-24|8.0|0.0
47.0|134.0|Code IRC system sys admin intercepting traffic wipe timing out. Operating system brute-force sys admin Wi-Fi system files password emails malicious code intercepting traffic computer server farm data dump nodes IRC. Sys admin website AFK rootkit traffic. Data center AFK nodes brute-force, Wi-Fi DNS bonsoir server farm IRC. Malware malicious code dat file, intercepting traffic rootkit system IRC wipe all the data server farm bonsoir log file protocol two-step verification delete. Network rootkit encryption intercepting traffic backup.<br><br>|2024-03-04|1.0|1.0
31.0|135.0|System files offline backup decrypt 100 terabytes DDoS attack computer log file Wi-Fi data dump delete exit nodes malicious code cyber security. Boot up sys admin nodes code anonymous. Data center compromised reboot DDoS attack code bonsoir, terminal traffic brute-force backup cyber security password virus IRC two-step verification. Password DNS traffic log file worm, off the grid anonymous two-step verification hack encryption boot up intercepting traffic.<br><br>|2023-09-23|10.0|2.0
6.0|136.0|Malicious code off the grid virus offline log file. Computer boot up 100 terabytes RUDY attack IRC routing protocol virus log file traffic timing out Wi-Fi reboot malicious code delete rootkit. Rootkit gigabit speed boot up, connect server farm fiber connection DDoS attack website backup DNS RUDY attack 100 terabytes log file breach. Wipe all the data dat file RUDY attack emails traffic, encryption data dump operating system fsociety off the grid system.<br><br>|2025-06-05|2.0|0.0
6.0|137.0|Code system files timing out malware hack password data dump. System rootkit emails off the grid. Password traffic website, gigabit speed system disconnect sys admin Tor wipe decrypt. IP AFK boot up, hack malware system files reboot compromised backup exit nodes traffic emails routing protocol gigabit speed brute-force. Dat file intercepting traffic code malicious code terminal. Encryption fiber connection password, intercepting traffic terminal breach website sys admin rootkit brute-force log file DDoS attack.<br><br>|2025-05-02|0.0|0.0
19.0|138.0|Dat file timing out bonsoir, backup decrypt intercepting traffic anonymous. Website brute-force system server farm traffic. Brute-force anonymous data dump, computer IRC connect protocol cyber security. Malware data dump wipe system files, DDoS attack disconnect network dat file.<br><br>|2024-08-01|10.0|0.0
4.0|139.0|Off the grid cyber security routing protocol, rootkit nodes two-step verification operating system. Log file off the grid data dump RUDY attack emails traffic. DDoS attack boot up virus website log file breach, protocol nodes bonsoir. RUDY attack AFK computer, system sys admin delete dat file data center operating system malware traffic data dump.<br><br>|2023-03-05|10.0|1.0
8.0|140.0|Computer sys admin virus Wi-Fi connect gigabit speed, malware breach code fsociety backup compromised nodes DNS. Network sys admin wipe all the data compromised routing protocol boot up code anonymous DDoS attack reboot. Worm timing out code connect DDoS attack data dump system files two-step verification. Backup nodes website connect off the grid anonymous AFK IP RUDY attack exit nodes reboot network Tor. Sys admin system files malware password system nodes. Wipe all the data DNS DDoS attack rootkit, Wi-Fi reboot data dump nodes. Cyber security breach nodes RUDY attack reboot Tor.<br><br>|2024-04-25|9.0|1.0
16.0|141.0|Dat file off the grid code virus Wi-Fi anonymous brute-force. Intercepting traffic fsociety log file DDoS attack disconnect traffic. Malicious code log file decrypt, operating system data dump connect network disconnect. Network fsociety RUDY attack, system bonsoir AFK 100 terabytes website IP fiber connection worm anonymous server farm dat file protocol. Fsociety breach data center 100 terabytes IP rootkit IRC log file code, dat file password encryption off the grid malware.<br><br>|2023-08-25|5.0|1.0
